{
  "account_id": "acme",
  "company_name": "ACME Dental Care",
  "business_hours": "8am to 6pm Monday through Thursday, and 9am to 1pm on Friday",
  "office_address": "123 Main Street, Suite 400, Springfield.",
  "services_supported": [
    "appointment scheduling, rescheduling, cancellations, and basic billing questions"
  ],
  "emergency_definition": null,
  "emergency_routing_rules": "For emergencies, we transfer calls directly to our on-call doctor.",
  "non_emergency_routing_rules": null,
  "call_transfer_rules": null,
  "integration_constraints": [
    "practice management system, but for now the agent should not say anything about integrations"
  ],
  "after_hours_flow_summary": "after hours, the agent should collect the caller's name, phone number, and address, then transfer to the on-call doctor at our emergency line.",
  "office_hours_flow_summary": "During business hours, emergencies should be transferred immediately to the clinical lead at the front desk.",
  "questions_or_unknowns": [
    "emergency_definition: Emergency definition not clearly stated after onboarding.",
    "non_emergency_routing_rules: Non-emergency routing not clearly described after onboarding.",
    "call_transfer_rules: Call transfer rules not clearly described after onboarding."
  ],
  "notes": [
    "No explicit integration constraints were mentioned in demo calls; verify integrations during onboarding."
  ]
}